### ISSUE TITLE
Can't access to any website even it seems it's working.

### ISSUE THREAD

**Issue by emailforos** [iganeshk/adwireguard-dark#9]
Hi.

I deployed your docker in a free Oracle VPS and I have a problem. Adguard is receiving the DNS queries but my cell phone is not receiving the answer so it doesn't enter to any website.

My setup is:

```
adwireguard:
    container_name: adwireguard
    # image: ghcr.io/iganeshk/adwireguard-dark:latest
    image: iganesh/adwireguard-dark:latest
    restart: unless-stopped
    ports:
      - '53:53'           # AdGuardHome DNS Port
      - '3000:3000'       # Default Address AdGuardHome WebUI
      - '853:853'         # DNS-TLS
      - '51820:51820/udp' # wiregaurd port
      - '51821:51821/tcp' # wg-easy webUI
    environment:
        # WG-EASY ENVS
      - WG_HOST=xxx.duckdns.org
      - PASSWORD=${PASS}
      - WG_PORT=51820
      - WG_DEFAULT_ADDRESS=10.10.11.x
      - WG_DEFAULT_DNS=${APP_ADGUARD_IP}
      - WG_MTU=1420
      - WEBUI_HOST=0.0.0.0 # Change this to allow binding to other than 0.0.0.0 port
    volumes:
        # adguard-home volume
      - ${HOME}/docker/adguard/work:/opt/adwireguard/work
      - ${HOME}/docker/adguard/confdir:/opt/adwireguard/conf
        # wg-easy volume
      - ${HOME}/docker/wireguard:/etc/wireguard
    cap_add:
      - NET_ADMIN
      - SYS_MODULE
    sysctls:
      - net.ipv4.ip_forward=1
      - net.ipv4.conf.all.src_valid_mark=1
      - net.ipv6.conf.all.disable_ipv6=1    # Disable IPv6
    networks:
      default:
        ipv4_address: ${APP_ADGUARD_IP}`
```

And I'm able to reach adguard and wireguard webui.

In adguard I see that there are queries:
![imagen](https://github.com/iganeshk/adwireguard-dark/assets/20602874/67a74452-df0d-478a-a9c1-73341bc17a35)

And in wireguard, there is up/down changes:
![imagen](https://github.com/iganeshk/adwireguard-dark/assets/20602874/68a2efac-0687-462b-abb3-ca5e7e17c59a)

Before I was using adguard and wg-easy "standard" docker installation but I was looking for a solution to be able to see all the clients IP in adguard to customize the filtering (some for my wife and I, some for my kids).

I tried somethings but I'm noob in networks setup.

Any idea of what I can check or try?

Thank you in advance.

**Comment by emailforos** [comment]
> Hi.
> 
> I deployed your docker in a free Oracle VPS and I have a problem. Adguard is receiving the DNS queries but my cell phone is not receiving the answer so it doesn't enter to any website.
> 
> My setup is:
> 
> ```
> adwireguard:
>     container_name: adwireguard
>     # image: ghcr.io/iganeshk/adwireguard-dark:latest
>     image: iganesh/adwireguard-dark:latest
>     restart: unless-stopped
>     ports:
>       - '53:53'           # AdGuardHome DNS Port
>       - '3000:3000'       # Default Address AdGuardHome WebUI
>       - '853:853'         # DNS-TLS
>       - '51820:51820/udp' # wiregaurd port
>       - '51821:51821/tcp' # wg-easy webUI
>     environment:
>         # WG-EASY ENVS
>       - WG_HOST=xxx.duckdns.org
>       - PASSWORD=${PASS}
>       - WG_PORT=51820
>       - WG_DEFAULT_ADDRESS=10.10.11.x
>       - WG_DEFAULT_DNS=${APP_ADGUARD_IP}
>       - WG_MTU=1420
>       - WEBUI_HOST=0.0.0.0 # Change this to allow binding to other than 0.0.0.0 port
>     volumes:
>         # adguard-home volume
>       - ${HOME}/docker/adguard/work:/opt/adwireguard/work
>       - ${HOME}/docker/adguard/confdir:/opt/adwireguard/conf
>         # wg-easy volume
>       - ${HOME}/docker/wireguard:/etc/wireguard
>     cap_add:
>       - NET_ADMIN
>       - SYS_MODULE
>     sysctls:
>       - net.ipv4.ip_forward=1
>       - net.ipv4.conf.all.src_valid_mark=1
>       - net.ipv6.conf.all.disable_ipv6=1    # Disable IPv6
>     networks:
>       default:
>         ipv4_address: ${APP_ADGUARD_IP}`
> ```
> 
> And I'm able to reach adguard and wireguard webui.
> 
> In adguard I see that there are queries: ![imagen](https://private-user-images.githubusercontent.com/20602874/289382833-67a74452-df0d-478a-a9c1-73341bc17a35.png?jwt=eyJhbGciOiJIUzI1NiIsInR5cCI6IkpXVCJ9.eyJpc3MiOiJnaXRodWIuY29tIiwiYXVkIjoicmF3LmdpdGh1YnVzZXJjb250ZW50LmNvbSIsImtleSI6ImtleTEiLCJleHAiOjE3MDIzMTMzNTcsIm5iZiI6MTcwMjMxMzA1NywicGF0aCI6Ii8yMDYwMjg3NC8yODkzODI4MzMtNjdhNzQ0NTItZGYwZC00NzhhLWE5YzEtNzMzNDFiYzE3YTM1LnBuZz9YLUFtei1BbGdvcml0aG09QVdTNC1ITUFDLVNIQTI1NiZYLUFtei1DcmVkZW50aWFsPUFLSUFJV05KWUFYNENTVkVINTNBJTJGMjAyMzEyMTElMkZ1cy1lYXN0LTElMkZzMyUyRmF3czRfcmVxdWVzdCZYLUFtei1EYXRlPTIwMjMxMjExVDE2NDQxN1omWC1BbXotRXhwaXJlcz0zMDAmWC1BbXotU2lnbmF0dXJlPWM4MjkwNzE3Zjg1NWJhNWYzYjRlYWUxZWU3ODBhZGVjOWIxYjdjMzEyY2UwNWJjZjg1ZDRjMzA1ZTFlNGE2YjgmWC1BbXotU2lnbmVkSGVhZGVycz1ob3N0JmFjdG9yX2lkPTAma2V5X2lkPTAmcmVwb19pZD0wIn0.31hP_QSJZHos0znKtrcQ_g8HoUWc6ooLxHi6zMM-KTk)
> 
> And in wireguard, there is up/down changes: ![imagen](https://private-user-images.githubusercontent.com/20602874/289382914-68a2efac-0687-462b-abb3-ca5e7e17c59a.png?jwt=eyJhbGciOiJIUzI1NiIsInR5cCI6IkpXVCJ9.eyJpc3MiOiJnaXRodWIuY29tIiwiYXVkIjoicmF3LmdpdGh1YnVzZXJjb250ZW50LmNvbSIsImtleSI6ImtleTEiLCJleHAiOjE3MDIzMTMzNTcsIm5iZiI6MTcwMjMxMzA1NywicGF0aCI6Ii8yMDYwMjg3NC8yODkzODI5MTQtNjhhMmVmYWMtMDY4Ny00NjJiLWFiYjMtY2E1ZTdlMTdjNTlhLnBuZz9YLUFtei1BbGdvcml0aG09QVdTNC1ITUFDLVNIQTI1NiZYLUFtei1DcmVkZW50aWFsPUFLSUFJV05KWUFYNENTVkVINTNBJTJGMjAyMzEyMTElMkZ1cy1lYXN0LTElMkZzMyUyRmF3czRfcmVxdWVzdCZYLUFtei1EYXRlPTIwMjMxMjExVDE2NDQxN1omWC1BbXotRXhwaXJlcz0zMDAmWC1BbXotU2lnbmF0dXJlPTNjMWVmMWYwNjYzOGViZDMzYjhiMTJmNDA5NGFjNjQ1Y2Y3MjE4OGM5MTExMjcyYTA4OTkxYzc0MzY1MWRiZjYmWC1BbXotU2lnbmVkSGVhZGVycz1ob3N0JmFjdG9yX2lkPTAma2V5X2lkPTAmcmVwb19pZD0wIn0.YftkOzTc3BCRU9FBh_gl38KEPFC2wNSWCJqxhNDRiDc)
> 
> Before I was using adguard and wg-easy "standard" docker installation but I was looking for a solution to be able to see all the clients IP in adguard to customize the filtering (some for my wife and I, some for my kids).
> 
> I tried somethings but I'm noob in networks setup.
> 
> Any idea of what I can check or try?
> 
> Thank you in advance.

UPDATE: 
With the VPN activated I can reach all the web ui's of the docker services I'm running: Portainer, Uptime-kuma, but I can't access an external website.

**Comment by Komaax** [comment]
I already had this setup up and running, since the update from yesterday I'm experiencing similar problems. The performance on my windows-client went downhill. It takes an eternity to load websites (even though the DNS-Requests are answered fast). On android phone external websites are not reachabel (dns_probe_possible). With WG disabled, everything works like a charm.

**Comment by emailforos** [comment]
UPDATE:
I've made a tcpdump in the docker and I see a lot of messages like:

````
10:19:54.398829 IP 10.10.11.4.60995 > fa005bb81348.53: 59550+ AAAA? www.google.com. (32)
10:19:54.420527 IP 10.10.11.1.53 > 10.10.11.4.60995: 59550 1/0/0 AAAA 2a00:1450:4001:81c::2004 (60)
10:19:54.488269 IP 10.10.11.4 > 10.10.11.1: ICMP 10.10.11.4 udp port 60995 unreachable, length 96
10:19:56.409015 IP 10.10.11.4.60995 > fa005bb81348.53: 59550+ AAAA? www.google.com. (32)
10:19:56.409290 IP 10.10.11.1.53 > 10.10.11.4.60995: 59550 1/0/0 AAAA 2a00:1450:4001:81c::2004 (60)
10:19:56.478938 IP 10.10.11.4 > 10.10.11.1: ICMP 10.10.11.4 udp port 60995 unreachable, length 96
10:20:01.409387 IP 10.10.11.4.1601 > fa005bb81348.53: 57598+ A? www.google.com. (32)
10:20:01.426724 IP 10.10.11.1.53 > 10.10.11.4.1601: 57598 1/0/0 A 216.58.206.36 (48)
10:20:01.498673 IP 10.10.11.4 > 10.10.11.1: ICMP 10.10.11.4 udp port 1601 unreachable, length 84
10:20:11.048789 IP 10.10.11.4.1601 > fa005bb81348.53: 57598+ A? www.google.com. (32)
10:20:11.049130 IP 10.10.11.1.53 > 10.10.11.4.1601: 57598 1/0/0 A 216.58.206.36 (48)
10:20:11.119412 IP 10.10.11.4 > 10.10.11.1: ICMP 10.10.11.4 udp port 1601 unreachable, length 84
10:20:24.889023 IP 10.10.11.4.40351 > fa005bb81348.53: 64945+ AAAA? www.google.com. (32)
10:20:24.889371 IP 10.10.11.1.53 > 10.10.11.4.40351: 64945 1/0/0 AAAA 2a00:1450:4001:81c::2004 (60)
10:20:24.958643 IP 10.10.11.4 > 10.10.11.1: ICMP 10.10.11.4 udp port 40351 unreachable, length 96
10:20:32.829012 IP 10.10.11.4.40351 > fa005bb81348.53: 64945+ AAAA? www.google.com. (32)
10:20:32.829380 IP 10.10.11.1.53 > 10.10.11.4.40351: 64945 1/0/0 AAAA 2a00:1450:4001:81c::2004 (60)
10:20:32.898914 IP 10.10.11.4 > 10.10.11.1: ICMP 10.10.11.4 udp port 40351 unreachable, length 96
````

I suppose that something is blocking some UDP connections. 

I'm sorry that my knowledge is so reduced to know what it's really happening and to find a solution.

**Comment by emailforos** [comment]
@iganeshk, please, can you have a look to this issue?

@Komaax, did you find a solution?

I'm interested in your solution to be able to filter my son's cell phones and pcs in a different way than my wife's.

**Comment by FreshImmuc** [comment]
+1

**Comment by FreshImmuc** [comment]
@emailforos @Komaax If you have the same problem as i did you can try my fixed config in #10

**Comment by emailforos** [comment]
> @emailforos @Komaax If you have the same problem as i did you can try my fixed config in #10

Hi, @FreshImmuc.

It seems to work.

I will give it a try this weekend.

Thank you.

**Comment by FreshImmuc** [comment]
Sure, tell me if it worked :)
